5db7717e-0a31-4b3a-9d1d-c9273470a23e,built_up_areas_2011,,Built Up Areas (2011),This file contains the digital vector boundaries for built-up areas in England and Wales as at 27 March 2011 (Census day). The built-up area boundaries are generalised and created using an automated approach based on a 50m grid squares. ,environmental; maps_and_locations,https://geoportal.statistics.gov.uk/datasets/ons::built-up-areas-dec-2011-boundaries-v2/about,GIS,CSV; Shapefile; SQLite Geodatabase; GeoPackage; GeoJSON; Excel,office_for_national_statistics,Office for National Statistics (ONS),<10MB,Low (quarterly - annually),,,,,,Download
e67431b1-1c03-4d19-8c0e-9b85dbae804b,asset_register_land_ownership_polygons,,Asset register and land ownership polygons,Land and Property owned by Bristol City Council,environmental; maps_and_locations,https://opendata.bristol.gov.uk/datasets/bcc::asset-register-and-land-ownership/about,GIS,CSV; KML; Shapefile; GeoJSON,bristol_city_council,Bristol City Council,,Low (quarterly - annually),,,,,,Download
03b286d3-fac5-49e7-b218-396d52b47265,bristol_leisure_cycle_rides_routes,,Bristol leisure cycle rides routes,Dataset showing routes of leisure rides for bicycles in and around Bristol,maps_and_locations; walking_and_cycling,https://opendata.bristol.gov.uk/datasets/bcc::leisure-rides-cycling/about,GIS,CSV; KML; Shapefile; GeoJSON,bristol_city_council,Bristol City Council,,Low (quarterly - annually),,Open Government Licence,,,,Download
81a3afaf-e498-41b2-92ed-587ebb509eb0,rider_zones_27700,,Rider Zones 27700,Rider Zones map showing boundaries for the use of Rider tickets in the West of England.,buses; maps_and_locations,https://opendata.bristol.gov.uk/datasets/bcc::rider-zones/about,GIS,CSV; JSON; KML; Shapefile,travelwest,Travelwest,,Low (quarterly - annually),,,,,,Download
f6a78032-226c-4704-98b7-377adf1b5fc2,car_availability_household_2011_oa,,Car Availability Household 2011 Oa Poly,Car and van availability in households by Output Areas,demographic; road_traffic_travel_and_parking,https://statistics.ukdataservice.ac.uk/dataset/car-or-van-availability-2011/resource/7544ad18-8577-4200-bd9f-53f8963dbc9d,GIS,CSV,office_for_national_statistics,Office for National Statistics (ONS),<100MB,Low (quarterly - annually),,Open Government Licence,,,,Download
816fcd6f-d7fb-4dba-805f-242cec4a8ae2,connected_nations,,Connected Nations,Datasets underpinning the Ofcom connected Nations report. This is based on mobile coverage and fixed broadband availability across the UK as of January 2022.,demographic; social,https://www.ofcom.org.uk/research-and-data/multi-sector-research/infrastructure-research/connected-nations-update-spring-2022,GIS,CSV,ofcom,Ofcom,<100MB,Low (quarterly - annually),,,,,,Download
d7ff5e4c-e1c2-4d8d-b343-edf9ea8959e4,os_mastermap_greenspace,,OS MasterMap Greenspace,"The OS MasterMap Greenspace Layer dataset has been designed for the public sector, it shows accessible and non-accessible greenspaces in urban areas, helping to support a wider set of government initiatives around health and the environment. This is a paid for dataset but is avaible for public sector use under PSGA",accessibility; maps_and_locations,https://www.ordnancesurvey.co.uk/products/os-mastermap-greenspace-layer,GIS,ESRI Shapefile; GML; GeoPackage; Vector Tiles,ordnance_survey,Ordnance Survey (OS),,Low (quarterly - annually),,Public Sector Geospatial Agreement (PSGA),,,,Download
dbaeb98c-4dca-4c6c-96a5-df42c8f2148f,os_mastermap_topography,,OS MasterMap Topography,"The OS MasterMap Topography layer is presented seamlessly with more than 500 Million real world objects – all uniquely identified - including roads, buildings, parks and waterways all managed and maintained by Ordnance Survey within one of the world’s largest spatial databases.? This is a paid for dataset but is avaible for public sector use under PSGA",maps_and_locations,https://www.ordnancesurvey.co.uk/products/os-mastermap-topography-layer,GIS,GML,ordnance_survey,Ordnance Survey (OS),,Moderate (weekly-monthly),,Public Sector Geospatial Agreement (PSGA),,,,Download
642e65f9-30d2-4e91-8ebd-0326f03ced14,os_open_greenspace,,OS Open Greenspace,"The location of public parks, playing fields, sports facilities, play areas, allotments and more with OS Open Greenspace.",maps_and_locations; social,https://www.ordnancesurvey.co.uk/products/os-open-greenspace,GIS,ESRI Shapefile; GML; GeoPackage; Vector Tiles,ordnance_survey,Ordnance Survey (OS),,Low (quarterly - annually),,Open Government Licence,,,,Download
61b0925e-8fda-4176-bd17-1884874b9c5b,os_open_rivers,,OS Open Rivers,"A dataset showing the high-level view of watercourses in Great Britain. OS Open Rivers GIS data contains over 144,000 km of water bodies and watercourses map data. These include freshwater rivers, tidal estuaries and canals.",environmental; maps_and_locations,https://www.ordnancesurvey.co.uk/products/os-open-rivers,GIS,ESRI Shapefile; GML; GeoPackage; Vector Tiles,ordnance_survey,Ordnance Survey (OS),,Low (quarterly - annually),,Open Government Licence,,,,Download
7af66b99-0613-4c99-9aea-d87c836cf516,os_open_uprn,,OS Open UPRN,UPRNs (Unique Property Reference Number) are the authoritative identifier used to uniquely identify addressable locations in Great Britain. Essential for bringing property and address information together.,demographic; maps_and_locations,https://www.ordnancesurvey.co.uk/products/os-open-uprn,GIS,CSV; GeoPackage,ordnance_survey,Ordnance Survey (OS),,Moderate (weekly-monthly),,Open Government Licence,,,,Download
088d0d3f-13f5-42a7-aaae-54821a6343fc,public_rights_of_way_bnesc,,Public rights of way (Bath & North East Somerset Council),"Dataset containing the public rights of way of Bath and North East Somerset.  The details of the public rights of way network contained in an authority's data are for information only, and are an interpretation of the Definitive Map, not the Definitive Map itself, and should not be relied on for determining the position or alignment of any public right of way",maps_and_locations; walking_and_cycling,https://www.rowmaps.com/datasets/BS/,GIS,MapInfo,bnes_council,Bath & North East Somerset Council,<10MB,Low (quarterly - annually),,Open Government Licence,,,Open,Download
d242bb5f-e9e2-4487-9f01-2ac2fd74f052,public_rights_of_way_bcc,,Public rights of way (BCC),"Dataset containing the public rights of way of Bristol City Council.  The details of the public rights of way network contained in an authority's data are for information only, and are an interpretation of the Definitive Map, not the Definitive Map itself, and should not be relied on for determining the position or alignment of any public right of way",maps_and_locations; walking_and_cycling,https://www.rowmaps.com/datasets/BZ/,GIS,ESRI Shapefile,bristol_city_council,Bristol City Council,<10MB,Low (quarterly - annually),,Open Government Licence,,,Open,Download
d7eb090b-dbff-4398-9f10-069b3b7d0284,public_rights_of_way_nsc,,Public rights of way (NSC),"Dataset containing the public rights of way of North Somerset.  The details of the public rights of way network contained in an authority's data are for information only, and are an interpretation of the Definitive Map, not the Definitive Map itself, and should not be relied on for determining the position or alignment of any public right of way",maps_and_locations; walking_and_cycling,https://www.rowmaps.com/datasets/NS/,GIS,ESRI Shapefile,north_somerset_council,North Somerset Council,<10MB,Low (quarterly - annually),,Open Government Licence,,,Open,Download
b8161356-2433-49ab-a09a-7623961a0ca3,public_rights_of_way_sglos,,Public rights of way (SGLOS),"Dataset containing the public rights of way of South Gloucestershire.  The details of the public rights of way network contained in an authority's data are for information only, and are an interpretation of the Definitive Map, not the Definitive Map itself, and should not be relied on for determining the position or alignment of any public right of way",maps_and_locations; walking_and_cycling,https://www.rowmaps.com/datasets/SG/,GIS,ESRI Shapefile,south_gloucestershire_council,South Gloucestershire Council,<10MB,Low (quarterly - annually),,Open Government Licence,,,Open,Download
,,,,,,,,,,,,,,,,,,
,,,,,,,,,,,,,,,,,,
